"The image demonstrates the flow pattern taken in the right vertebral artery. What should be done next to better evaluate these findings<br><br><b>A:</b> Inflate a pneumatic cuff on the left arm to a level of 20mmHg above systolic pressure, wait 2 minutes to rapidly deflate and rescan<br><b>B:</b> Have the patient perform the Valsalva maneuver and rescan during the strain<br><b>C:</b> Have the patient perform the Valsalva maneuver and rescan during the release<br><b>D:</b> Inflate a pneumatic cuff on the right arm to a level of 20mmHg above systolic pressure, wait 2 minutes to rapidly deflate and rescan<br><br><img src=""q74.jpg"" alt=""Question 74 image"">"	<b>Answer:</b> D. Inflate a pneumatic cuff on the right arm to a level of 20mmHg above systolic pressure, wait 2 minutes to rapidly deflate and rescan<br><br><b>Feedback:</b><br>The waveform demonstrates early systolic deceleration and is called &quot;pre-steal waveform&quot;. This is a sign of a proximal stenosis<br>of the subclavian artery. Provocative maneuvers can be used to evaluate the ability to convert the waveform to a partial or<br>complete steal. Arm exercise followed by a repeat scan. Pneumatic cuff inflation on the affected arm for 2-3 minutes followed<br>by rapid release and repeat scan.
Which of the following is a condition that cannot be evaluated with Transcranial Doppler?<br><br><b>A:</b> MCA disease<br><b>B:</b> vertebro-basilar disease<br><b>C:</b> patent foramen ovale<br><b>D:</b> temporal arteritis	<b>Answer:</b> D. temporal arteritis<br><br><b>Feedback:</b><br>The temporal artery is located extracranially and requires a high frequency probe to evaluate the superficial vessel. A PFO can<br>be evaluated using microbubbles to assess shunt flow in the heart. Microbubbles injected into the venous circulation should not<br>end up in the arterial vessels of the brain. An ASD must be present if the air embolisms are identified as turbulent spikes in the<br>Doppler tracing of the intracranial arteries.
"The string flow sign is associated with which of the following diagnoses?<br><br><b>A:</b> critical ICA stenosis<br><b>B:</b> fibromuscular dysplasia<br><b>C:</b> AV fistula<br><b>D:</b> superficial phlebitis<br><br><img src=""q76.jpg"" alt=""Question 76 image"">"	<b>Answer:</b> A. critical ICA stenosis<br><br><b>Feedback:</b><br>The string sign refers to a critical stenosis that only allows a thin string of blood through the tiny opening. The flow velocity will<br>be very low with decreased pulsatility. The risk for total occlusion is extremely high in these cases. FMD causes the appearance<br>of a string of beads.
"Which of the following would lead to underestimation of stenosis in the internal carotid artery?<br><br><b>A:</b> Short area of focal stenosis<br><b>B:</b> Significant aortic valve stenosis<br><b>C:</b> Elevated heart rate<br><b>D:</b> Compensatory flow due to stenosis on other side<br><br><img src=""q77.jpg"" alt=""Question 77 image"">"	<b>Answer:</b> B. Significant aortic valve stenosis<br><br><b>Feedback:</b><br>Underestimation of stenosis in the ICA can be seen with:<br>Reduced systemic blood pressure<br>Proximal stenosis - such as significant aortic valve stenosis<br>Long area of focal stenosis<br>Tandem stenosis or eccentric stenosis<br>Critical stenosis (string flow)<br>Reduced cardiac output - CHF, coronary artery disease, dilated cardiomyopathy
"Which of the following terms would be used to describe flow identified just proximal to a 95% ICA stenosis?<br><br><b>A:</b> tardus parvus<br><b>B:</b> low resistance<br><b>C:</b> damped<br><b>D:</b> laminar<br><br><img src=""q78.jpg"" alt=""Question 78 image"">"	<b>Answer:</b> C. damped<br><br><b>Feedback:</b><br>Pre-Stenotic Zone:<br>Increased resistance and resistive index<br>Flow velocity may be damped with loss of diastolic flow<br>Short acceleration time<br>Called stump or thump flow<br>Note the first waveform on the image below. Low velocity with little to no diastolic flow. There is a critical stenosis of the ICA<br>which causes increased resistance to flow proximally.
Which of the following demonstrates the correct calculation for the Lindegaard Ratio?<br><br><b>A:</b> siphon peak systolic velocity divided by proximal ICA peak systolic velocity<br><b>B:</b> MCA mean flow velocity divided by siphon peak systolic velocity<br><b>C:</b> MCA mean flow velocity divided by distal ICA mean flow velocity<br><b>D:</b> ACA peak systolic velocity divided by distal ICA peak systolic velocity	<b>Answer:</b> C. MCA mean flow velocity divided by distal ICA mean flow velocity<br><br><b>Feedback:</b><br>The Lindegaard Ratio (Hemispheric index) is calculated using the MCA mean flow velocity and dividing it by the distal ICA mean<br>flow velocity. It is used to evaluate a suspected vasospasm and/or hyperperfusion.
What cardiac complication is related to the appearance of the carotid waveform? view image<br><br><b>A:</b> aortic regurgitation<br><b>B:</b> pulmonary stenosis<br><b>C:</b> mitral regurgitation<br><b>D:</b> cardiac tamponade	<b>Answer:</b> A. aortic regurgitation<br><br><b>Feedback:</b><br>Blood moves back through the aortic valve into the left ventricle during diastole. It is usually caused by diseased valve,<br>congenital defects and chamber or aortic dilatation. Significant regurgitation results in volume overload in the chamber<br>receiving the retrograde blood flow. With aortic regurgitation, volume overload occurs in the left ventricle. Pulsus bisferiens can<br>occur in the carotid arteries. The waveforms will demonstrate double systolic peaks. Severe regurgitation is associated with<br>diastolic flow reversal in the carotid arteries (Water Hammer Pulse).
"Select the area of the color display where the highest systolic velocity would be demonstrated on PW Doppler evaluation. Click to set the cursor and confirm your answer.<br><br><img src=""q81.png"" alt=""Question 81 image"">"	<b>Answer:</b> Unavailable<br><br><b>Feedback:</b><br>The highest velocity of flow is seen within the stenosis and just as the blood exits the most narrowed area. When evaluating a<br>suspected stenosis, it is important to take several samples with small adjustments to the position of the sample volume in order<br>to locate the highest velocities present.
A pulsatility index of &gt; 1.2 in the cerebral vessels indicates:<br><br><b>A:</b> normal flow resistance<br><b>B:</b> vasospasm<br><b>C:</b> mildly decreased resistance<br><b>D:</b> severely decreased resistance	<b>Answer:</b> B. vasospasm<br><br><b>Feedback:</b><br>The greater the PI, the greater the variation of velocity throughout the cardiac cycle. The greater the PI, the higher the resistance<br>to flow. Cerebral vessels should normally have a low PI value. Vasospasm causes increased resistance in cerebral vessels and an<br>increased PI value.
"The bilateral proximal common carotid arteries demonstrate normal velocity and systolic upstroke. Diastolic flow reversal is present and continues throughout diastole. These findings are most consistent with:<br><br><b>A:</b> significant aortic valve regurgitation<br><b>B:</b> mid CCA occlusion<br><b>C:</b> mild to moderate aortic valve stenosis<br><b>D:</b> proximal ICA occlusion<br><br><img src=""q83.jpg"" alt=""Question 83 image"">"	<b>Answer:</b> A. significant aortic valve regurgitation<br><br><b>Feedback:</b><br>Significant aortic valve regurgitation will cause flow to move from the ascending aorta/arch into the left ventricle during diastole.<br>This can cause flow reversal that lasts throughout diastole in the branches of the arch. Both CCA will be affected. The flow<br>pattern is called a Water Hammer Pulse.<br>If there was an ICA occlusion, the CCA velocity would be reduced with minimal diastolic flow reversal in early diastole.
"You perform a bilateral carotid Doppler and there is very little plaque formation. All other waveforms appear within normal limits, but the mid and distal left ICA segments demonstrate the waveform on the image. What is the best way to evaluate the patient based on these findings?<br><br><b>A:</b> TCD exam to evaluate the left carotid siphon<br><b>B:</b> TCD exam to evaluate the vertebrobasilar system<br><b>C:</b> TCD exam to evaluate the right carotid siphon<br><b>D:</b> TCD exam to evaluate the direction of flow in the anterior cerebral communicator artery<br><br><img src=""q84.jpg"" alt=""Question 84 image"">"	<b>Answer:</b> A. TCD exam to evaluate the left carotid siphon<br><br><b>Feedback:</b><br>High resistance flow in the ICA indicates increased resistance downstream. Obstruction of the siphon can cause increased<br>resistance in the mid/distal ICA.
Which of the following correctly describes the standard protocol for performing cerebral angiography?<br><br><b>A:</b> the Seldinger technique is used to puncture the common femoral artery in order to insert a catheter that will be advanced to the left ventricle for contrast administration<br><b>B:</b> the Seldinger technique is used to puncture the common femoral artery in order to insert a catheter that will be advanced to the aortic arch for contrast administration<br><b>C:</b> the Seldinger technique is used to puncture the brachial artery in order to insert a catheter that will be advanced to the left ventricle for contrast administration<br><b>D:</b> the Seldinger technique is used to puncture the common carotid artery and inject contrast through a catheter	<b>Answer:</b> B. the Seldinger technique is used to puncture the common femoral artery in order to insert a catheter that will be advanced to the aortic arch for contrast administration<br><br><b>Feedback:</b><br>The Seldinger technique is used to puncture the common femoral artery in order to insert a catheter that will be advanced to<br>the aortic arch for contrast administration. Contrast is released and enters the aortic arch branches to fill both carotid arteries.<br>If the catheter is inserted into one of the carotid arteries, contrast would only fill that side of the system. Catheter insertion into<br>the brachial artery would fill vessels distal to the puncture site = forearm/hand. Catheter insertion into the femoral artery would<br>fill vessels distal to the puncture site = leg/foot.
A patient presents for a carotid Doppler exam due to left arm and leg paresthesia. Which vessel should be closely evaluated for a potential vascular cause of the symptom?<br><br><b>A:</b> left ICA<br><b>B:</b> left vertebral<br><b>C:</b> right vertebral<br><b>D:</b> right ICA	<b>Answer:</b> D. right ICA<br><br><b>Feedback:</b><br>Symptoms of stroke that occur in the body are associated with ICA disease on the contralateral side. Left extremity paresthesia<br>would be associated with right ICA disease.
"A bilateral visual symptom, such as diplopia, is commonly associated with disease in which artery?<br><br><b>A:</b> Anterior Cerebral<br><b>B:</b> Vertebral<br><b>C:</b> Posterior Cerebral<br><b>D:</b> Innominate<br><br><img src=""q87.jpg"" alt=""Question 87 image"">"	<b>Answer:</b> B. Vertebral<br><br><b>Feedback:</b><br>In reference to symptoms related to cranial vessel disease, unilateral visual disturbances are most commonly associated with<br>disease in the ICA. Bilateral visual disturbances are most commonly associated with vertebrobasilar disease.
"Vertigo is a common symptom related to disease of which of the following vessels?<br><br><b>A:</b> basilar artery<br><b>B:</b> anterior cerebral artery<br><b>C:</b> internal carotid artery<br><b>D:</b> middle cerebral artery<br><br><img src=""q88.jpg"" alt=""Question 88 image"">"	<b>Answer:</b> A. basilar artery<br><br><b>Feedback:</b><br>The cerebellum is responsible for helping to maintain balance and equilibrium. The vertebral and basilar arteries give off<br>branches that supply the cerebellum. If flow is reduced in these arteries, cerebellar ischemia can occur leading to vertigo.
"What is the preferred manipulation technique that can be used to convert the partial subclavian steal into a complete steal?<br><br><b>A:</b> Re-scan the patient in Fowler&#x27;s position.<br><b>B:</b> Have the patient squeeze a stress ball 40 times in the right arm and then re-evaluate the vertebral flow.<br><b>C:</b> Have the patient perform 40 flexion/extension maneuvers of the left arm and then re-evaluate the vertebral flow.<br><b>D:</b> Have patient sit up in an exaggerated military stance and then re-evaluate the vertebral flow.<br><br><img src=""q89.jpg"" alt=""Question 89 image"">"	<b>Answer:</b> C. Have the patient perform 40 flexion/extension maneuvers of the left arm and then re-evaluate the vertebral flow.<br><br><b>Feedback:</b><br>By exercising the left arm, the muscles will require more incoming blood flow. The pressure in the distal arm will decrease to<br>allow more flow to travel to the arm. The left vertebral artery is the only supplying vessel for the left arm, due to the subclavian<br>occlusion. This increase in blood flow needs in the left arm will lead to complete reversal of flow in the left vertebral as it tries to<br>keep up with the change in the blood flow needs in the left arm.
"Which of the following statements is true regarding the images displayed?<br><br><b>A:</b> The increased PSV in the CCA is due to a single site of stenosis causing increased velocity and turbulence.<br><b>B:</b> There is focal atherosclerosis formation within the distal CCA.<br><b>C:</b> The Doppler tracing indicates laminar flow.<br><b>D:</b> The increase in PSV in the CCA is due to the multiple adjacent lesions causing increased resistance.<br><br><img src=""q90_1.png"" alt=""Question 90 image""><br><br><img src=""q90_2.png"" alt=""Question 90 image"">"	<b>Answer:</b> D. The increase in PSV in the CCA is due to the multiple adjacent lesions causing increased resistance.<br><br><b>Feedback:</b><br>Note the diffuse atheroma formation along the length of the CCA which causes a combined effect on the flow velocity within the<br>vessel.
Which of the following patients has the lowest risk of a future stroke that affects the right side?<br><br><b>A:</b> 60% left ICA stenosis caused by heterogeneous calcific plaque<br><b>B:</b> no appreciable plaque identified in the left ICA<br><b>C:</b> total occlusion of the left ICA<br><b>D:</b> 20% left ICA stenosis caused by smooth, soft plaque	<b>Answer:</b> C. total occlusion of the left ICA<br><br><b>Feedback:</b><br>A stenosis on the left internal carotid artery will cause symptoms on the right side of the body. The risk of a future stroke on<br>that side drops significantly when the internal carotid artery is totally occluded. If a stroke would occur, it would have happened<br>at the time the occlusion occurred.
Which cerebral vessel is most commonly involved in an acute cerebral ischemia?<br><br><b>A:</b> Posterior cerebral artery<br><b>B:</b> Middle cerebral artery<br><b>C:</b> basilar artery<br><b>D:</b> Anterior cerebral artery	<b>Answer:</b> B. Middle cerebral artery<br><br><b>Feedback:</b><br>The MCA is most commonly involved in an acute occlusion and cerebral ischemia due to its connection to the ICA.
The image demonstrated is from a routine carotid ultrasound. Based on this image, what should be done next to evaluate this patient?<br><br><b>A:</b> Evaluate the left vertebral to see if the waveform is also high resistance<br><b>B:</b> Perform a TCD exam to look for a contralateral MCA for obstruction<br><b>C:</b> Evaluate the right subclavian artery for the presence of monophasic flow<br><b>D:</b> Evaluate the left subclavian artery for the presence of monophasic flow	<b>Answer:</b> A. Evaluate the left vertebral to see if the waveform is also high resistance<br><br><b>Feedback:</b><br>The high resistance triphasic waveform in the vertebral artery indicate a distal obstruction. If the left vertebral is also triphasic,<br>there is most likely a basilar obstruction. If the left vertebral is normal and monophasic, there must be a distal vertebral<br>obstruction on the right side. A TCD exam could identify an obstruction in the basilar artery that would explain this vertebral<br>waveform.
What is the most common cause of cerebrovascular disease?<br><br><b>A:</b> vasospasm<br><b>B:</b> atherosclerosis<br><b>C:</b> stroke<br><b>D:</b> embolism	<b>Answer:</b> B. atherosclerosis<br><br><b>Feedback:</b><br>Atherosclerosis formation is the most common cause of cerebrovascular disease. Embolism formation is much less common<br>and is usually a complication of atherosclerosis formation. A stroke is a potential complication with all types of cerebrovascular<br>disease.
The carotid compression test is used to _______________, while the carotid sinus massage is used to ______________________.<br><br><b>A:</b> increase flow in the vertebral arteries, decrease flow in the vertebral arteries<br><b>B:</b> stimulate TIA symptoms, reduce TIA symptoms<br><b>C:</b> reduce the heart rate, evaluate the presence of collateral flow<br><b>D:</b> evaluate the presence of collateral flow, reduce the heart rate	<b>Answer:</b> D. evaluate the presence of collateral flow, reduce the heart rate<br><br><b>Feedback:</b><br>The carotid compression test is used to evaluate for the presence of collateral flow, while the carotid sinus massage is used to<br>reduce the heart rate to diagnose/treat certain arrhythmias. .
"If the CCA PSV is 80cm/s and the CCA EDV is 40cm/s, what is the systolic velocity ratio?<br><br><b>A:</b> 1.0<br><b>B:</b> 2.1<br><b>C:</b> 4.9<br><b>D:</b> 9.7<br><br><img src=""q96.jpg"" alt=""Question 96 image"">"	<b>Answer:</b> C. 4.9<br><br><b>Feedback:</b><br>Systolic Velocity Ratio = PSV ICA / PSV CCA<br>388cm/s / 80 cm/s = 4.9<br>There should not be challenging calculations on the registry exam because you will not have access to a calculator. The<br>importance of this question is to know how to make the calculation.
"What measurement is being taken in the image?<br><br><b>A:</b> Continuity equation<br><b>B:</b> Diameter stenosis<br><b>C:</b> IMT<br><b>D:</b> Area stenosis<br><br><img src=""q97.jpg"" alt=""Question 97 image"">"	<b>Answer:</b> D. Area stenosis<br><br><b>Feedback:</b><br>Area stenosis is calculated by measuring the area of the vessel and the true lumen .<br>Area 1 minus Area 2 divided by Area 1 X 100%<br>EX: 4cm2 - 2.5cm2 / 4cm2 = 0.375 = 38% stenosis
"A patient presents with episodes of left eye amaurosis fugax and right sided paresthesia. These findings are most suggestive of:<br><br><b>A:</b> 80% LT ECA stenosis<br><b>B:</b> RT ICA occlusion<br><b>C:</b> LT CCA stenosis proximal to current point of evaluation<br><b>D:</b> LT ICA occlusion<br><br><img src=""q98.jpg"" alt=""Question 98 image"">"	<b>Answer:</b> D. LT ICA occlusion<br><br><b>Feedback:</b><br>The Left CCA waveform demonstrates very high resistance flow with flow reversal in diastole. This is indicative of a LT ICA<br>occlusion distally. The ipsilateral visual disturbance and contralateral limb paresthesia also support this diagnosis.
If there is a 90% stenosis in the left carotid siphon, which of the following is true?<br><br><b>A:</b> left vertebral flow will be high resistance<br><b>B:</b> left mid ICA flow will be high resistance<br><b>C:</b> right MCA will be high resistance<br><b>D:</b> left MCA flow will be high resistance	<b>Answer:</b> B. left mid ICA flow will be high resistance<br><br><b>Feedback:</b><br>Distal stenosis will lead to high resistance flow proximally = ICA high resistance with siphon stenosis<br>Proximal stenosis will lead to low resistance flow distally = MCA and ACA lower resistance with siphon stenosis
Which of the following describes the path of an embolus?<br><br><b>A:</b> a small piece of soft plaque breaks off from the carotid bulb and floats toward the brain<br><b>B:</b> a small piece of thrombus breaks off from a thrombus in the right ventricle and floats toward the brain<br><b>C:</b> a small piece of thrombus breaks off from a thrombus in the left ventricle and floats toward the lungs<br><b>D:</b> a small piece of soft plaque breaks off from the carotid bulb and floats toward the lungs	<b>Answer:</b> A. a small piece of soft plaque breaks off from the carotid bulb and floats toward the brain<br><br><b>Feedback:</b><br>An embolus is a floating piece of debris, air bubble, thrombus or plaque that moves distally until it lodges in a small vessel.<br>Thrombus in the right ventricle will be sent to pulmonary artery and the lungs = pulmonary embolism. Thrombus in the left<br>ventricle can be sent to the brain through the aorta = stroke. An embolus in the carotid system will go to the brain.
Why is the carotid compression technique performed?<br><br><b>A:</b> to evaluate the venous outflow of the intracranial vessels<br><b>B:</b> to evaluate the effects of vasospasm<br><b>C:</b> to evaluate the presence of intracranial collateral formation<br><b>D:</b> to evaluate the carotid as a potential arterial graft	<b>Answer:</b> C. to evaluate the presence of intracranial collateral formation<br><br><b>Feedback:</b><br>Carotid Compression Test is performed by a PHYSICIAN ONLY!! Used to evaluate the risk for carotid treatment; Compress<br>unilateral CCA for approximately 5 minutes, if no symptoms occur, collaterals are present that are compensating for reduced<br>flow.
Bilateral bruits are detected in the proximal neck. This finding is most suggestive of:<br><br><b>A:</b> Subclavian steal<br><b>B:</b> Aortic valve stenosis<br><b>C:</b> Polycythemia vera<br><b>D:</b> CHF	<b>Answer:</b> B. Aortic valve stenosis<br><br><b>Feedback:</b><br>Bilateral carotid bruits and changes in both carotid flow patterns can be related to aortic stenosis. If the aortic valve is stenotic<br>causing increased flow velocity and turbulence, flow in both carotids will reflect this change and may demonstrate bilateral<br>bruits. CHF would lead to decreased flow through both carotids but a bruit would most likely NOT be identified due to slow<br>moving flow.
"Which of the following would be used to describe a Doppler waveform taken in the mid ICA with a critical stenosis of the proximal segment?<br><br><b>A:</b> increased pulsatility index<br><b>B:</b> peaked<br><b>C:</b> increased resistive index<br><b>D:</b> damped<br><br><img src=""q103.jpg"" alt=""Question 103 image"">"	<b>Answer:</b> D. damped<br><br><b>Feedback:</b><br>The Doppler waveform will be blunted and significantly damped downstream with a significant obstruction proximal to the<br>point of insonation. There will be minimal diastolic flow, but no flow reversal.
"If there is an occlusion at the proximal ICA, what will happen to the flow in the CCA?<br><br><b>A:</b> Turbulent with decreased resistance/increased diastolic flow<br><b>B:</b> No effect on CCA flow until bulb area<br><b>C:</b> Damped with increased resistance/decreased diastolic flow<br><b>D:</b> Damped with unaffected resistance<br><br><img src=""q104.jpg"" alt=""Question 104 image"">"	<b>Answer:</b> C. Damped with increased resistance/decreased diastolic flow<br><br><b>Feedback:</b><br>The ECA normally demonstrates high resistance systolic flow with minimal diastolic flow. The ICA usually demonstrates low<br>resistance systolic flow with increased diastolic flow. The CCA normally demonstrates a combined flow pattern from both of the<br>branches with resistance and diastolic flow at levels between the ECA and the ICA. If the ICA is occluded, the CCA will<br>demonstrate a flow pattern very similar to the ECA because it is now the only CCA branch and resistance to flow is increased.
"What is the diameter stenosis of the vessel on the image?<br><br><b>A:</b> 82%<br><b>B:</b> 24%<br><b>C:</b> 56%<br><b>D:</b> 76%<br><br><img src=""q105.jpg"" alt=""Question 105 image"">"	<b>Answer:</b> D. 76%<br><br><b>Feedback:</b><br>(0.54 - 0.13 / 0.54) X 100% = 0.41 / 0.54 = 0.76 x 100% = 76%<br>There should not be challenging calculations on the registry exam because you will not have access to a calculator. The<br>importance of this question is to know how to make the calculation.
A patient presents for a carotid ultrasound for pre-op testing for an aortic valve replacement surgery. The echo report in their chart indicates the stenosis is severe. What is the best way to determine if carotid stenosis is present in this patient?<br><br><b>A:</b> using the peak systolic and end systolic velocity of the CCA<br><b>B:</b> unable to evaluate carotid stenosis in patients with known heart disease<br><b>C:</b> calculate the ICA/CCA systolic and diastolic velocity ratios<br><b>D:</b> using the peak systolic and end systolic velocity of the ICA	<b>Answer:</b> C. calculate the ICA/CCA systolic and diastolic velocity ratios<br><br><b>Feedback:</b><br>With aortic valve stenosis, blood flow increases in velocity as it moves through the narrowed valve. The flow into the ascending<br>aorta will be turbulent. Characteristics of post-stenotic flow can be transmitted to the carotid arteries: lower resistance,<br>turbulence and reduced velocity. Brachial pressures may also be lower than normal. The ICA/CCA systolic and diastolic velocity<br>ratios should be used to assess the patient for carotid stenosis because peak velocities may be diminished.
The most common location of atherosclerotic formation in the cerebrovascular system?<br><br><b>A:</b> vertebrobasilar system<br><b>B:</b> circle of Willis<br><b>C:</b> carotid bifurcation<br><b>D:</b> ophthalmic and orbital arteries	<b>Answer:</b> C. carotid bifurcation<br><br><b>Feedback:</b><br>The most common location of atherosclerotic formation in the cerebrovascular system occurs at the carotid bifurcation.
