"Which of the following will result in a low resistance antegrade external carotid artery waveform with increased antegrade flow in diastole?<br><br><b>A:</b> ipsilateral mid common carotid artery occlusion<br><b>B:</b> temporal arteritis<br><b>C:</b> contralateral subclavian stenosis<br><b>D:</b> ipsilateral mid common carotid artery stenosis<br><br><img src=""q36.jpg"" alt=""Question 36 image"">"	<b>Answer:</b> D. ipsilateral mid common carotid artery stenosis<br><br><b>Feedback:</b><br>The ECA normally demonstrates a high resistance flow pattern with minimal antegrade diastolic flow. A proximal stenosis will<br>cause reduced resistance in the flow/waveforms distally. Stenosis proximal to the ECA (in the CCA) or in the proximal ECA will<br>cause lower resistance ECA flow with increased antegrade flow in diastole. If the ipsilateral ICA is occluded, these same changes<br>will occur.
"What is the expected waveform characteristic if the Doppler sample volume is placed at the same location as the calipers?<br><br><b>A:</b> triphasic with increased peak systolic and end diastolic velocities<br><b>B:</b> blunted waveform with increased diastolic flow<br><b>C:</b> increased peak systolic velocity and decreased end diastolic velocity<br><b>D:</b> monophasic with increased peak systolic and end diastolic velocities<br><br><img src=""q37.jpg"" alt=""Question 37 image"">"	<b>Answer:</b> D. monophasic with increased peak systolic and end diastolic velocities<br><br><b>Feedback:</b><br>The calculated diameter stenosis is 76% which indicates a severe stenosis. The waveform at the stenosis will indicate a<br>monophasic waveform with increased systolic and diastolic flow pattern.
Which of the following is not part of the standard TCD protocol for vasospasm?<br><br><b>A:</b> Perform serial exams to evaluate flow velocity in the MCA<br><b>B:</b> Calculate the Lindegaard Ratio<br><b>C:</b> Report all mean flow velocities in the MCA that are greater than 120cm/s<br><b>D:</b> Measure any anechoic spaces around the brain that could indicate a hemorrhage	<b>Answer:</b> D. Measure any anechoic spaces around the brain that could indicate a hemorrhage<br><br><b>Feedback:</b><br>A TCD exam for vasospasm involves performing serial evaluations of the MCA velocities. Report all mean flow velocities in the<br>MCA that are greater than 120cm/s because this indicates a positive exam. The Lindegaard Ratio is calculated by dividing the<br>mean MCA velocity by the mean ICA velocity. A ratio &gt;3 indicates a positive exam. There is no 2D imaging in a TCD exam,<br>therefore the cerebral tissue cannot be evaluated.
The findings on the image are most suggestive of: view image<br><br><b>A:</b> pulmonary hypertension<br><b>B:</b> aortic valve stenosis<br><b>C:</b> malignant hypertension<br><b>D:</b> mitral valve stenosis	<b>Answer:</b> B. aortic valve stenosis<br><br><b>Feedback:</b><br>Aortic Valve Stenosis is usually caused by degenerative disease, but can be caused by congenital malformation of the aortic<br>valve (bicuspid AV). Blood flow increases in velocity as it moves through the narrowed valve. The flow into the ascending aorta<br>will be turbulent. Characteristics of post-stenotic flow can be transmitted to the carotid arteries: lower resistance, turbulence<br>and reduced velocity. Brachial pressures may also be lower than normal. The ICA/CCA systolic and diastolic velocity ratios<br>should be used to assess the patient for carotid stenosis.
Which of the following will not demonstrate a bruit on auscultation?<br><br><b>A:</b> occlusion<br><b>B:</b> stenosis<br><b>C:</b> AV fistula<br><b>D:</b> pseudoaneurysm	<b>Answer:</b> A. occlusion<br><br><b>Feedback:</b><br>An occlusion will not demonstrate a bruit because no flow is moving under the stethoscope.
"A patient that experienced a fall from 15ft yesterday presents with acute hemiparesis and dysphasia. These clinical findings are most suggestive of:<br><br><b>A:</b> spontaneous intracerebral aneurysm rupture<br><b>B:</b> carotid dissection<br><b>C:</b> polycythemia vera<br><b>D:</b> basilar artery rupture<br><br><img src=""q41.jpg"" alt=""Question 41 image"">"	<b>Answer:</b> B. carotid dissection<br><br><b>Feedback:</b><br>A carotid dissection should be suspected with trauma. Spontaneous intracerebral aneurysm rupture and basilar artery rupture<br>would cause critical loss of blood within the cranium. In most cases death would be eminent within hours. At 36hrs post trauma,<br>these two diagnoses are very unlikely.
"What is causing the waveform displayed?<br><br><b>A:</b> proximal stenosis<br><b>B:</b> subclavian steal<br><b>C:</b> arrhythmia<br><b>D:</b> distal stenosis<br><br><img src=""q42.jpg"" alt=""Question 42 image"">"	<b>Answer:</b> C. arrhythmia<br><br><b>Feedback:</b><br>Note the difference in timing of the systolic peaks of the waveform. This indicates a cardiac arrhythmia. In this case atrial<br>fibrillation is present. The velocity demonstrated is normal for the vertebral arteries.
If both carotid waveforms look like the image above, you should check the patient chart to see if they have: view image<br><br><b>A:</b> constrictive pericarditis<br><b>B:</b> subclavian steal<br><b>C:</b> an intra-aortic balloon pump<br><b>D:</b> severe aortic stenosis	<b>Answer:</b> C. an intra-aortic balloon pump<br><br><b>Feedback:</b><br>IABP assisted waveforms have 2 systolic peaks for each pulse. The first peak indicates the left ventricular contraction. The<br>second peak indicates the balloon inflation. EDV cannot be determined in the patients with an IABP because flow reversal is<br>commonly seen after the balloon deflation. If possible, turn off the IABP during carotid evaluation. If this is not possible, velocity<br>from the first peak should be used as the PSV.<br>Image Credit<br>Adapted from: Ginat, D., Massey, H. T., Bhatt, S., &amp; Dogra, V. S. (2011). Imaging of mechanical cardiac assist devices. Journal of<br>clinical imaging science, 1, 21. doi:10.4103/2156-7514.80373 Copyright-open license
"Select the area of the color display where the largest spectral window would be demonstrated on PW Doppler evaluation. Click to set the cursor and confirm your answer.<br><br><img src=""q44.png"" alt=""Question 44 image"">"	<b>Answer:</b> Unavailable<br><br><b>Feedback:</b><br>Large spectral window = laminar flow. The area of the common carotid artery that most proximal to the stenosis would<br>demonstrate the most laminar flow. Laminar flow is also best displayed from the center of the vessel. Spectral broadening will<br>occur at the stenosis and distal to the stenosis due to turbulence.
"Bilateral tardus parvus waveforms in the carotid arteries can indicate:<br><br><b>A:</b> pulmonary regurgitation<br><b>B:</b> mitral stenosis<br><b>C:</b> pulmonary stenosis<br><b>D:</b> mitral regurgitation<br><br><img src=""q45.jpg"" alt=""Question 45 image"">"	<b>Answer:</b> B. mitral stenosis<br><br><b>Feedback:</b><br>Significant stenosis can cause left atrial pressure overload and reduced cardiac output. The carotid arteries will demonstrate<br>low resistance, low velocity flow with reduced cardiac output. Bilateral tardus parvus waveforms in the carotid arteries can<br>indicate severe mitral stenosis.
Which of the following conditions would cause an increase in the systemic BP in just the right arm?<br><br><b>A:</b> aortic coarctation just distal to the origin of the left common carotid artery<br><b>B:</b> right subclavian steal<br><b>C:</b> thoracic outlet syndrome of the right arm<br><b>D:</b> right subclavian artery stenosis	<b>Answer:</b> A. aortic coarctation just distal to the origin of the left common carotid artery<br><br><b>Feedback:</b><br>If aortic coarctation occurs just distal to the origin of the left common carotid artery, BP will be reduced in the left arm and<br>increased in the right arm. BP will be reduced in the right arm with the other choices.
"This patient presents with a bruit, palpable mass, mild SOB and dizziness. These findings are most suggestive of:<br><br><b>A:</b> AV fistula<br><b>B:</b> Pseudoaneurysm<br><b>C:</b> Carotid body tumor<br><b>D:</b> Thyroid mass<br><br><img src=""q47.jpg"" alt=""Question 47 image"">"	<b>Answer:</b> C. Carotid body tumor<br><br><b>Feedback:</b><br>With only a 2D image, a diagnosis regarding the presence or absence of stenosis cannot be accurately made. The arrow<br>indicates a large mass at the CCA bifurcation that surrounds the ICA. This is the classic appearance and location for a carotid<br>body tumor. The symptoms listed are commonly seen with this type of tumor. The thyroid is located much more distally in the<br>neck, therefore a thyroid mass is very unlikely.
"The PW Doppler tracing was obtained from the CCA. Which statement below is true regarding the image?<br><br><b>A:</b> Normal high resistance, triphasic flow is demonstrated<br><b>B:</b> Abnormal high resistance flow due to increased flow in Vertebral supply<br><b>C:</b> Abnormal high resistance flow due to ICA occlusion<br><b>D:</b> Abnormal high resistance flow due to proximal stenosis<br><br><img src=""q48.jpg"" alt=""Question 48 image"">"	<b>Answer:</b> C. Abnormal high resistance flow due to ICA occlusion<br><br><b>Feedback:</b><br>Note the flow reversal in diastole with no antegrade flow during the full diastolic portion of the cycle. This indicates significant<br>resistance distal to the area evaluated. An occluded ICA can lead to the increase in resistance in the CCA which causes the<br>waveform type displayed on the image.
"Regarding the image below, where will Reynold&#x27;s number be the highest?<br><br><b>A:</b> immediately proximal to the caliper location<br><b>B:</b> immediately distal to the caliper location<br><b>C:</b> in the CCA bulb<br><b>D:</b> distal ICA<br><br><img src=""q49.jpg"" alt=""Question 49 image"">"	<b>Answer:</b> B. immediately distal to the caliper location<br><br><b>Feedback:</b><br>Flow in the arterial segment just distal to the stenosis will demonstrate the greatest amount of turbulence and highest<br>Reynold&#x27;s number. Flow with a Reynold&#x27;s number over 2000 is considered turbulent.
"Which of the following is a characteristic of an ICA waveform with 50- 69% stenosis?<br><br><b>A:</b> diastolic flow reversal<br><b>B:</b> increased peak systolic and end diastolic velocity<br><b>C:</b> clear spectral window<br><b>D:</b> decreased diastolic flow with EDV less than 20cm/s<br><br><img src=""q50.jpg"" alt=""Question 50 image"">"	<b>Answer:</b> B. increased peak systolic and end diastolic velocity<br><br><b>Feedback:</b><br>Stenosis in the ICA leads to increased systolic and diastolic flow velocities. Spectral broadening occurs with stenosis. Diastolic<br>flow reversal in the ICA is identified with an occlusion distal to the Doppler sample.
Which of the following would cause flow in the left ECA to reverse direction during systole?<br><br><b>A:</b> right CCA occlusion<br><b>B:</b> left vertebral artery occlusion<br><b>C:</b> left CCA occlusion<br><b>D:</b> left proximal ICA occlusion	<b>Answer:</b> C. left CCA occlusion<br><br><b>Feedback:</b><br>Ipsilateral CCA occlusion can cause ECA flow reversal so that it can supply the ICA with flow. Collateral flow from the<br>contralateral cerebral system will back fill the left ECA. Reversed flow in the ECA will fill the left ICA with blood because the CCA<br>is occluded.
Aside from the carotid artery, what other vessels are commonly affected by fibromuscular dysplasia (FMD)?<br><br><b>A:</b> jugular veins<br><b>B:</b> small arteries of the hand and wrist<br><b>C:</b> renal and mesenteric arteries<br><b>D:</b> small arteries of the foot and ankle	<b>Answer:</b> C. renal and mesenteric arteries<br><br><b>Feedback:</b><br>If FMD is identified in the carotid arteries, the renal and mesenteric arteries should also be evaluated for FMD. Stenosis caused<br>by atherosclerosis usually affects the origin of the artery, while FMD usually causes stenosis in the mid/distal artery.
Which cardiac abnormality usually has NO effect on the peak systolic velocities in the carotid arteries?<br><br><b>A:</b> aortic valve stenosis<br><b>B:</b> coronary artery disease<br><b>C:</b> mitral valve regurgitation<br><b>D:</b> cardiomyopathy	<b>Answer:</b> C. mitral valve regurgitation<br><br><b>Feedback:</b><br>Cardiac structure and function should be considered on all vascular evaluations. Changes in cardiac function can affect the<br>velocities in the arterial system and change the flow characteristics of the venous system. Mitral regurgitation does NOT affect<br>the systolic velocities in the arterial system. Aortic stenosis, mitral stenosis, CHF, diastolic dysfunction, dilated cardiomyopathy<br>and CAD can reduce the cardiac ejection fraction and falsely reduce the PSV in the arterial system. Systemic HTN, aortic<br>regurgitation, hypertrophic cardiomyopathy and compensatory heart beats with arrhythmias can falsely elevate the PSV.
"You are performing a TCD exam to assess collateral flow with a right ICA occlusion. You identify flow moving away from the transducer at 90cm/s with decreased pulsatility in the right ophthalmic artery. The left ophthalmic artery demonstrates flow moving toward the transducer with a velocity of 45cm/s. What is indicated by these findings?<br><br><b>A:</b> ECA to ICA collateralization<br><b>B:</b> Posterior to anterior collateralization<br><b>C:</b> Cross over collateralization<br><b>D:</b> Normal flow parameters, no collateralization present<br><br><img src=""q54.png"" alt=""Question 54 image"">"	<b>Answer:</b> A. ECA to ICA collateralization<br><br><b>Feedback:</b><br>The superficial temporal artery and the inferior maxillary artery are branches of the ECA that communicate with branches of the<br>ophthalmic artery. Flow moves from the ECA to these branches and refills the ophthalmic artery to send flow back into the<br>areas affected by the ipsilateral ICA occlusion.
"What cardiac complications are associated with the findings on the image? view image<br><br><b>A:</b> aortic regurgitation or pulmonary regurgitation<br><b>B:</b> mitral stenosis or pulmonary stenosis<br><b>C:</b> coronary artery disease or aortic stenosis<br><b>D:</b> cardiac tamponade or constrictive pericarditis<br><br><img src=""q55.jpg"" alt=""Question 55 image"">"	<b>Answer:</b> D. cardiac tamponade or constrictive pericarditis<br><br><b>Feedback:</b><br>Pulsus Alternans - the peak systolic velocity alternates between two levels with each heartbeat. Pulsus Alternans is associated<br>with cardiac tamponade, dilated cardiomyopathy and constrictive pericarditis
The external carotid artery normally demonstrates a velocity below:<br><br><b>A:</b> 100cm/s<br><b>B:</b> 80cm/s<br><b>C:</b> 150cm/s<br><b>D:</b> 230cm/s	<b>Answer:</b> C. 150cm/s<br><br><b>Feedback:</b><br>The external carotid artery normally demonstrates a velocity below 150 cm/s
"Which of the following terms is a type of visual disturbance where half of the field of view is disrupted in the eye?<br><br><b>A:</b> ectopia<br><b>B:</b> homonymous hemianopia<br><b>C:</b> myopia<br><b>D:</b> diplopia<br><br><img src=""q57.jpg"" alt=""Question 57 image"">"	<b>Answer:</b> B. homonymous hemianopia<br><br><b>Feedback:</b><br>This visual disturbance can be unilateral or bilateral and is commonly caused by ischemia in the occipital lobe of the brain.<br>Medial or lateral half of the field of view in the eye is &quot;absent&quot; while the other half appears normal.
Aspirin would be the preferred treatment for which of the following patients?<br><br><b>A:</b> 60% internal carotid stenosis<br><b>B:</b> total occlusion of an internal carotid artery<br><b>C:</b> presence of significant venous reflux<br><b>D:</b> compartment syndrome	<b>Answer:</b> A. 60% internal carotid stenosis<br><br><b>Feedback:</b><br>Aspirin prevents platelet aggregation in the arteries which reduces the ability of plaque to form. Patients with mild to moderate<br>carotid stenosis can benefit from an aspirin each day.
Which of the following defines a stroke?<br><br><b>A:</b> nerve conduction abnormalities within the cerebral tissue<br><b>B:</b> acute ischemia in cerebral tissue<br><b>C:</b> occlusion of the internal carotid artery<br><b>D:</b> mobile piece of plaque or thrombus	<b>Answer:</b> B. acute ischemia in cerebral tissue<br><br><b>Feedback:</b><br>Loss of blood flow to an area of cerebral tissue causes cerebral ischemia. All strokes are not caused by ICA occlusion and not<br>every patient with an occluded ICA has a stroke.
"The red arrows on the image are pointing to what abnormal characteristic of the Doppler waveform?<br><br><b>A:</b> Formation of a spectral window<br><b>B:</b> Vibrations from post stenotic turbulence<br><b>C:</b> Temporal tap response<br><b>D:</b> Crosstalk artifact<br><br><img src=""q60.jpg"" alt=""Question 60 image"">"	<b>Answer:</b> B. Vibrations from post stenotic turbulence<br><br><b>Feedback:</b><br>The arrows indicate varied flow velocities seen in post-stenotic turbulence. Note the multiple and numerous velocity spikes<br>throughout the tracing and the mosaic color displayed on the guiding image. The ICA does not typically respond to the temporal<br>tap maneuver. The rate of spiking would not be possible with normal tapping for the maneuver.
What is the most common location of an intracranial aneurysm?<br><br><b>A:</b> Anterior communicating artery<br><b>B:</b> Middle cerebral artery<br><b>C:</b> Internal carotid artery siphon<br><b>D:</b> Posterior communicating artery	<b>Answer:</b> A. Anterior communicating artery<br><br><b>Feedback:</b><br>The anterior communicating artery is the most common location for a berry or saccular intracranial aneurysm.
"Which of the following is a characteristic of the Doppler waveform obtained at the site of stenosis in an ICA with 80% stenosis?<br><br><b>A:</b> spectral window<br><b>B:</b> blunted waveform<br><b>C:</b> decreased acceleration time<br><b>D:</b> increased diastolic flow<br><br><img src=""q62.jpg"" alt=""Question 62 image"">"	<b>Answer:</b> D. increased diastolic flow<br><br><b>Feedback:</b><br>As stenosis increases, peak systolic and end diastolic velocities increase. Acceleration time increases as stenosis increases. As<br>the vessel nears 99% stenosis, systolic and diastolic flow may be significantly reduced. Occlusion will lead to increased<br>resistance in the proximal vessel.
Broca aphasia can be defined as:<br><br><b>A:</b> Inability to swallow liquids<br><b>B:</b> Inability to understand speech, speak, or follow directions<br><b>C:</b> Inability to speak but can understand and follow directions<br><b>D:</b> Inability to swallow solid food	<b>Answer:</b> C. Inability to speak but can understand and follow directions<br><br><b>Feedback:</b><br>Broca aphasia (AKA expressive aphasia) can be defined as the inability to speak but can understand and follow directions.
Which of the following is a potential symptom caused by a subclavian steal?<br><br><b>A:</b> systemic HTN<br><b>B:</b> unilateral amaurosis fugax<br><b>C:</b> pulmonary HTN<br><b>D:</b> syncope	<b>Answer:</b> D. syncope<br><br><b>Feedback:</b><br>Vertebrobasilar disease is associated with syncope. Amaurosis fugax is a visual disturbance than can be related to ICA stenosis.<br>HTN is a risk factor for developing vascular disease.
If the left proximal CCA demonstrates a PSV of 35cm/s and the right proximal CCA demonstrates a PSV of 115cm/s, which of the following could explain the findings?<br><br><b>A:</b> aortic valve stenosis<br><b>B:</b> left ICA occlusion<br><b>C:</b> congestive heart failure<br><b>D:</b> decreased hematocrit levels	<b>Answer:</b> B. left ICA occlusion<br><br><b>Feedback:</b><br>If a single CCA demonstrates elevated velocity = tortuosity on that side or compensatory flow due to obstruction in the other<br>carotid system. If the left ICA is occluded, flow in the CCA will be low velocity with a quick upstroke and little to no diastolic flow.<br>The right CCA velocity can increase as it tries to provide the additional cerebrovascular flow needed. The left vertebral artery<br>may also demonstrate elevated velocity as it tries to compensate for the ipsilateral ICA occlusion. The other choices would cause<br>bilateral hemodynamic changes.
A peak systolic velocity of 100 cm/s is an indication of ___________ in the ICA.<br><br><b>A:</b> normal flow<br><b>B:</b> mild stenosis<br><b>C:</b> moderate stenosis<br><b>D:</b> severe stenosis	<b>Answer:</b> A. normal flow<br><br><b>Feedback:</b><br>The peak systolic flow velocity in the ICA is normal when it is less than 125cm/s.
What is the best quantitative parameter to use to estimate internal carotid artery stenosis in patients with severe aortic valve stenosis?<br><br><b>A:</b> end diastolic velocity<br><b>B:</b> velocity ratio<br><b>C:</b> acceleration time<br><b>D:</b> peak systolic and end diastolic velocities	<b>Answer:</b> B. velocity ratio<br><br><b>Feedback:</b><br>Flow in the carotid arteries will be diminished in patients with significant aortic valve stenosis. When cardiac output is reduced,<br>the flow velocities in the carotid systems will be reduced. This can lead to underestimation of ICA stenosis. The velocity ratio is<br>used to provide a more accurate of estimate stenosis in these patients.
"Which of the following describes collateral flow from the ECA to the ICA on the same side of the body?<br><br><b>A:</b> posterior communicator to the basilar artery<br><b>B:</b> superior thyroidal artery to the ACA<br><b>C:</b> lingual artery to the MCA<br><b>D:</b> superficial temporal artery to the ophthalmic artery<br><br><img src=""q68.png"" alt=""Question 68 image"">"	<b>Answer:</b> D. superficial temporal artery to the ophthalmic artery<br><br><b>Feedback:</b><br>Branches of the superficial temporal artery meet with branches of the supraorbital artery. Retrograde flow in the supraorbital<br>artery will enter the ophthalmic artery, reversed flow will be identified in the ophthalmic artery. Flow will be moving back toward<br>the ICA instead of outward toward the eye.
Which of the following scenarios demonstrates the highest risk for embolization?<br><br><b>A:</b> Buerger disease<br><b>B:</b> chronic ICA occlusion<br><b>C:</b> 60% ICA stenosis with moderate, smooth calcific atheroma<br><b>D:</b> 40% ICA stenosis with mild, irregular soft atheroma	<b>Answer:</b> D. 40% ICA stenosis with mild, irregular soft atheroma<br><br><b>Feedback:</b><br>Stenosis of the internal carotid artery carries the highest risk of TIA. Soft plaque has a much higher risk of embolization than the<br>&quot;fixed&quot; calcific atherosclerosis.
The most accurate Doppler predictor of ICA stenosis is:<br><br><b>A:</b> the end diastolic velocity<br><b>B:</b> the systolic ratio (ICAs/CCAs)<br><b>C:</b> the diastolic ratio (ICAd/CCAd)<br><b>D:</b> the peak systolic velocity	<b>Answer:</b> D. the peak systolic velocity<br><br><b>Feedback:</b><br>Recent studies have shown that the most accurate Doppler predictor of ICA stenosis is the peak systolic velocity.
A patient presents for a carotid ultrasound due to recent episodes of near syncope. Noticeable respiratory variation in the peak velocities of the carotid arteries is present. What cardiac complication should be suspected?<br><br><b>A:</b> cardiac tamponade<br><b>B:</b> tricuspid stenosis<br><b>C:</b> low cardiac output<br><b>D:</b> mitral stenosis	<b>Answer:</b> A. cardiac tamponade<br><br><b>Feedback:</b><br>Cardiac tamponade is a critical finding that requires pericardiocentesis. Severe pericardial effusion within the fibrous<br>pericardium causes extrinsic compression of the right heart chambers. Respiratory variation in arterial flow velocities will occur.<br>Flow diminishes with inspiration and normalizes with expiration. Another sign of cardiac tamponade is pulsus alternans. Pulsus<br>Alternans - the peak systolic velocity alternates between two levels with each beat. Pulsus Alternans is also associated with<br>dilated cardiomyopathy and constrictive pericarditis.
The image demonstrates the flow pattern taken in the right vertebral artery. Which of the following best describes the findings?<br><br><b>A:</b> Probable stenosis of the left subclavian artery<br><b>B:</b> Probable stenosis of the right subclavian artery<br><b>C:</b> The vertebral vein flow is demonstrated not the artery.<br><b>D:</b> There is an obstruction distally in the intracranial circulation	<b>Answer:</b> B. Probable stenosis of the right subclavian artery<br><br><b>Feedback:</b><br>The waveform demonstrates early systolic deceleration and is called &quot;pre-steal waveform&quot;. This is a sign of a proximal stenosis<br>of the subclavian artery. Provocative maneuvers can be used to evaluate the ability to convert the waveform to a partial or<br>complete steal. Arm exercise followed by a repeat scan. Pneumatic cuff inflation on the affected arm for 2-3 minutes followed<br>by rapid release and repeat scan.
"Which of the following is a characteristic of the Doppler waveform obtained distal to the site of stenosis in an ICA that demonstrates string flow on color Doppler?<br><br><b>A:</b> spectral window<br><b>B:</b> blunted waveform<br><b>C:</b> increased diastolic flow<br><b>D:</b> decreased acceleration time<br><br><img src=""q73.jpg"" alt=""Question 73 image"">"	<b>Answer:</b> B. blunted waveform<br><br><b>Feedback:</b><br>Near occlusion of the ICA will lead to low velocity systolic flow with minimal diastolic flow (blunted waveform). Once total<br>occlusion occurs, diastolic flow ceases or flow reversal occurs in the artery just proximal to the occlusion.
