The ankle brachial index is commonly performed as a part of which of the following exams?<br><br><b>A:</b> strain gauge plethysmography<br><b>B:</b> photoplethysmography<br><b>C:</b> exercise testing<br><b>D:</b> transcutaneous oximetry	<b>Answer:</b> C. exercise testing<br><br><b>Feedback:</b><br>The ABI is performed at rest and with exercise. If the ABI decreases with exercise, arterial disease is present.
"All of the following terms could be used to describe the attached waveform, except :<br><br><b>A:</b> delayed acceleration<br><b>B:</b> reduced deceleration time<br><b>C:</b> tardus parvus<br><b>D:</b> low resistance<br><br><img src=""q75.jpg"" alt=""Question 75 image"">"	<b>Answer:</b> B. reduced deceleration time<br><br><b>Feedback:</b><br>The waveform demonstrates a slow upstroke (long AT) and late systolic peak that is consistent with a monophasic, tardus parvus waveform. The deceleration is delayed not shortened.
Which of the following risk factors has the highest incidence of lower extremity thrombus formation?<br><br><b>A:</b> Diabetes<br><b>B:</b> Recent hip surgery<br><b>C:</b> Polycythemia vera<br><b>D:</b> Rotator cuff repair	<b>Answer:</b> B. Recent hip surgery<br><br><b>Feedback:</b><br>Patients who have undergone any type of lower extremity surgery are at the greatest risk of DVT. The 3 factors of Virchow&#x27;s triad are present in these patients. Usually, these patients are confined to a bed for several days/weeks which leads to stasis. There are significant limitations with using blood thinners immediately following surgery because it would prevent the healing of the surgery and could lead to hemorrhage.
Which of the following patients would require reactive hyperemia testing instead of exercise testing for a lower extremity exam to evaluate new onset of left leg claudication?<br><br><b>A:</b> Prior history of synthetic graft in the right leg<br><b>B:</b> Prior history of DVT 3yrs ago<br><b>C:</b> Prior history of untreated multilevel disease in the right leg<br><b>D:</b> Prior history of coronary bypass surgery	<b>Answer:</b> C. Prior history of untreated multilevel disease in the right leg<br><br><b>Feedback:</b><br>Reactive hyperemia is the transient increase in blood flow that occurs after a brief period of ischemia. It commonly occurs following the removal of a tourniquet, unclamping an artery during surgery, or after vessel recanalization caused by a device or medication. Reactive Hyperemia Testing uses occlusive cuffs to simulate exercise in patients unable to perform treadmill testing. The procedure is used to simulate exercise for those patients unable to perform treadmill testing for arterial disease. If a patient has known disease in the right leg, the diseased leg may limit the treadmill exercise tolerance for the left leg. Reactive hyperemia testing will better evaluate the new symptoms in the left leg.
What are the average treadmill settings utilized in exercise testing?<br><br><b>A:</b> 5mph at 12% grade<br><b>B:</b> 5mph at 10% grade<br><b>C:</b> 2mph at 12% grade<br><b>D:</b> 3mph at 8% grade	<b>Answer:</b> C. 2mph at 12% grade<br><br><b>Feedback:</b><br>The average treadmill settings utilized in exercise testing is 2mph speed at 12% grade.
"Velocities in a reversed vein graft are usually _________ at the ________ anastomosis because it is the smaller end of the vein.<br><br><b>A:</b> higher, proximal<br><b>B:</b> lower, proximal<br><b>C:</b> higher, distal<br><b>D:</b> lower, distal<br><br><img src=""q79.jpg"" alt=""Question 79 image"">"	<b>Answer:</b> A. higher, proximal<br><br><b>Feedback:</b><br>Velocities in a reversed vein graft are usually higher at the proximal anastomosis because it is the smaller end of the vein.
Which of the following correctly describes normal flow in the hepatic vessels?<br><br><b>A:</b> the hepatic artery demonstrates hepatopetal flow<br><b>B:</b> the hepatic artery demonstrates hepatofugal flow<br><b>C:</b> the portal veins demonstrate hepatofugal flow<br><b>D:</b> the hepatic veins demonstrate hepatopetal flow	<b>Answer:</b> A. the hepatic artery demonstrates hepatopetal flow<br><br><b>Feedback:</b><br>Hepatofugal flow is flow that is moving out of the liver. Hepatopetal flow is flow that is moving toward/into the liver. The normal HA and PV demonstrate hepatopetal flow. The hepatic veins demonstrate hepatofugal flow.
How is Heparin administered to a patient with DVT?<br><br><b>A:</b> orally<br><b>B:</b> intra-arterial<br><b>C:</b> intravenous<br><b>D:</b> subcutaneous injection	<b>Answer:</b> C. intravenous<br><br><b>Feedback:</b><br>DVT treatment can include 5-10 day dose of intravenous Heparin to prevent clot extension, but it does not destroy current thrombus.
Jaw claudication, headaches and neck pain, and asymmetric brachial blood pressures are all symptoms related to:<br><br><b>A:</b> thoracic outlet syndrome<br><b>B:</b> thromboangiitis obliterans<br><b>C:</b> Marfan syndrome<br><b>D:</b> giant cell arteritis	<b>Answer:</b> D. giant cell arteritis<br><br><b>Feedback:</b><br>Giant Cell Arteritis: Temporal arteritis is associated with headaches and tenderness over the artery. Asymmetric brachial blood pressures are seen in patients with arteritis in extremities. Other symptoms include pain and/or stiffness in the neck, jaw claudication, and visual disturbances. TOS causes upper extremity symptoms. Thromboangiitis obliterans causes lower leg/feet/forearm/hand symptoms. Marfan syndrome is a connective tissue disorder associated with aortic dissection,
The distal femoral artery becomes the popliteal artery:<br><br><b>A:</b> at the end of the adductor canal<br><b>B:</b> in the popliteal fossa<br><b>C:</b> at the level of the heads of the gastrocnemius muscles<br><b>D:</b> at the level of the medial quadricep tendon	<b>Answer:</b> A. at the end of the adductor canal<br><br><b>Feedback:</b><br>The distal femoral artery becomes the popliteal artery at the end of the adductor canal (Hunter&#x27;s canal).
What system setting would result in false-positive findings for reflux in the great saphenous vein?<br><br><b>A:</b> high frame rate<br><b>B:</b> high color persistence settings<br><b>C:</b> high velocity scale settings<br><b>D:</b> high wall filter settings	<b>Answer:</b> B. high color persistence settings<br><br><b>Feedback:</b><br>High color persistence settings may result in false-positive color-flow findings for reflux. Increasing color persistence increases the amount of time the color is displayed on the image as blood flows. Increasing the color persistence can give the illusion of significant reflux because the color display is prolonged. High filter and velocity scale settings would result in less color display. A higher frame rate indicates a higher screen refresh rate and no extension of display of the color.
"Which of the following patients would benefit from a Percutaneous Transluminal Angioplasty?<br><br><b>A:</b> patient with recurrent pulmonary embolism<br><b>B:</b> patient with left ICA occlusion<br><b>C:</b> patient with chronic iliac DVT<br><b>D:</b> patient with 80% stenosis in proximal SFA<br><br><img src=""q85.jpg"" alt=""Question 85 image"">"	<b>Answer:</b> D. patient with 80% stenosis in proximal SFA<br><br><b>Feedback:</b><br>Percutaneous Transluminal Angioplasty is used to open areas of stenosis in an artery. This intervention cannot be performed on a fully occluded vessel.
Which of the following is unaffected by vasoconstriction and vasodilation in the arterioles?<br><br><b>A:</b> hydrostatic pressure<br><b>B:</b> the number of phases of flow in the arterial waveform<br><b>C:</b> the amount of diastolic flow in an artery<br><b>D:</b> peripheral resistance	<b>Answer:</b> A. hydrostatic pressure<br><br><b>Feedback:</b><br>Hydrostatic pressure is the weight of the column of blood in the vessels when standing. Vasoconstriction will increase peripheral resistance and increase resistance in the feeding arteries. Higher resistance flow will have less antegrade flow in diastole. Vasodilation will decrease peripheral resistance and decrease resistance in the feeding arteries. Lower resistance flow will have more antegrade flow in diastole. A biphasic waveform can become monophasic.
"What blood vessels are demonstrated on the cross section of the penis?<br><br><b>A:</b> helicine arteries<br><b>B:</b> urethral arteries<br><b>C:</b> dorsal arteries<br><b>D:</b> cavernosal arteries<br><br><img src=""q87.jpg"" alt=""Question 87 image"">"	<b>Answer:</b> D. cavernosal arteries<br><br><b>Feedback:</b><br>The image demonstrates a cross section of the penis. The two corpus cavernosum and the corpus spongiosum are identified. The cavernosal artery courses through the corpus cavernosum. Penile Vasculature: Internal iliac arteries give rise to the internal pudendal arteries, bulbourethral artery, and penile arteries. The penile artery branches into the dorsal and cavernosal arteries. The right and left cavernosal arteries enter the right and left CC, respectively. The helicine arteries are multiple tiny branches that penetrate the tissue. Superficial dorsal vein and deep dorsal vein provide the primary venous outflow routes
"A patient presents with persistent calf pain after a recent biking accident and spending a few days on bed rest. After visual inspection of the right leg, what type of vascular exam should be performed?<br><br><b>A:</b> Soft tissue exam to rule out hematoma formation<br><b>B:</b> Lower extremity arterial Doppler<br><b>C:</b> Lower extremity venous Doppler<br><b>D:</b> Segmental pressure exam<br><br><img src=""q88.jpg"" alt=""Question 88 image"">"	<b>Answer:</b> C. Lower extremity venous Doppler<br><br><b>Feedback:</b><br>The significant difference in size demonstrates fluid accumulation in the swollen leg. The recent trauma and few days of stasis while on bed rest most likely caused a DVT to form in the leg.
Which calf vessel&#x27;s anatomic course has been referred to as a &quot;stocking seam&quot;?<br><br><b>A:</b> superficial femoral vein (SFV)<br><b>B:</b> small saphenous vein (SSV)<br><b>C:</b> great saphenous vein (GSV)<br><b>D:</b> posterior tibial vein (PTV)	<b>Answer:</b> B. small saphenous vein (SSV)<br><br><b>Feedback:</b><br>The small saphenous vein originates very superficially in the distal posterior calf. It courses midline up the calf to reach the popliteal vein at or near the popliteal fossa. Its course has been said to resemble the seam of a type of pantyhose or stockings.
"What vessel is demonstrated as thrombosed on the image?<br><br><b>A:</b> short saphenous vein<br><b>B:</b> basilic vein<br><b>C:</b> great saphenous vein<br><b>D:</b> cephalic vein<br><br><img src=""q90.jpg"" alt=""Question 90 image"">"	<b>Answer:</b> C. great saphenous vein<br><br><b>Feedback:</b><br>Note the body marker indicator on the image along with the location of the vein just beneath the subcutaneous fat and anterior to the muscular fascia. The lack of a corresponding artery also indicates a superficial vein.
Which of the following patients would benefit from an exercise segmental pressure exam?<br><br><b>A:</b> Patient with claudication and a resting ABI of 0.95<br><b>B:</b> Patient with rest pain and resting ABI 0.4<br><b>C:</b> Patient with COPD and resting ABI of 0.9<br><b>D:</b> Patient with claudication and resting ABI 0.6	<b>Answer:</b> A. Patient with claudication and a resting ABI of 0.95<br><br><b>Feedback:</b><br>A normal resting ABI can become abnormal with exercise in patients with less severe disease. The patient with COPD would most likely be recommended for reactive hyperemia. An ABI that is less than 0.9 demonstrates PAD is present. The exercise exam will not provide any additional information to assist on the diagnosis of these patients.
"The femoral vein ______________________ the femoral artery.<br><br><b>A:</b> courses posterior to<br><b>B:</b> is usually much longer than<br><b>C:</b> is harder to compress than<br><b>D:</b> courses anterior to<br><br><img src=""q92.jpg"" alt=""Question 92 image"">"	<b>Answer:</b> A. courses posterior to<br><br><b>Feedback:</b><br>The femoral vein courses posterior to the femoral artery.
"Normal extremity arterial flow should demonstrate a _________________acceleration time.<br><br><b>A:</b> rapid<br><b>B:</b> prolonged<br><b>C:</b> blunted<br><b>D:</b> variable<br><br><img src=""q93.jpg"" alt=""Question 93 image"">"	<b>Answer:</b> A. rapid<br><br><b>Feedback:</b><br>Normal extremity arterial flow should demonstrate a rapid acceleration time.
Which of the following is a symptom usually related to vertebrobasilar disease?<br><br><b>A:</b> Receptive aphasia<br><b>B:</b> Dysphagia<br><b>C:</b> Expressive aphasia<br><b>D:</b> Unilateral visual disturbances	<b>Answer:</b> B. Dysphagia<br><br><b>Feedback:</b><br>Dysphagia refers to difficulty swallowing which is controlled by the brain stem. The vertebrobasilar system supplies the brain stem with blood. Unilateral visual disturbances, receptive aphasia, and expressive aphasia are symptoms related to ICA/MCA disease.
"The image represents what Doppler artifact?<br><br><b>A:</b> Spectral broadening<br><b>B:</b> Laminar flow<br><b>C:</b> Aliasing<br><b>D:</b> Cross Talk<br><br><img src=""q95.jpg"" alt=""Question 95 image"">"	<b>Answer:</b> C. Aliasing<br><br><b>Feedback:</b><br>The waveform wraps around the baseline with the highest velocities displayed incorrectly on the underside of the baseline. This issue is corrected by increasing the scale, use a lower freq. probe, change angle°, adjust approach to decrease distance to vessel, switch to CW.
What artery courses cephalad on the anterior right side of the trachea to bifurcate at the level of the sternoclavicular joint?<br><br><b>A:</b> subclavian artery<br><b>B:</b> vertebral artery<br><b>C:</b> carotid artery<br><b>D:</b> innominate artery	<b>Answer:</b> D. innominate artery<br><br><b>Feedback:</b><br>There is only one innominate (brachiocephalic) artery on the right side of the body. It originates from the aortic arch and travels cephalad in a position that is to the right and anterior to the trachea. It bifurcates into the right subclavian and vertebral arteries.
You are evaluating a cephalic vein for bypass graft potential. The vessel diameter is &lt;2mm for its entire length. What should you do next?<br><br><b>A:</b> apply a tourniquet to the forearm and remeasure the cephalic vein segments proximal to the tourniquet<br><b>B:</b> report the vein as unusable with a diameter at 2mm and select another upper extremity vein to evaluate for a potential graft<br><b>C:</b> report the vein as acceptable for harvest with a maximum diameter of 2mm<br><b>D:</b> apply a tourniquet to the upper arm and remeasure the cephalic vein segments distal to the tourniquet	<b>Answer:</b> D. apply a tourniquet to the upper arm and remeasure the cephalic vein segments distal to the tourniquet<br><br><b>Feedback:</b><br>&gt;3mm veins are preferred for graft procedures. The basilic and cephalic veins can be acceptable conduits. When performing the exam, the patient is supine with arm extended at side at a level lower than the heart or in a seated position with hand on lap. Tourniquets can be applied to the proximal extremity in cases where the veins are very small. The veins distal to the tourniquet should dilate to provide an accurate maximum diameter.
A patient presents for a venous Doppler evaluation of the left lower extremity. Thrombus is identified in the left leg. What should you include in the preliminary report?<br><br><b>A:</b> Amount of exercise the patient performed before symptoms occurred<br><b>B:</b> What leg position causes the most pain<br><b>C:</b> Location, estimated age and extent of thrombus<br><b>D:</b> The peak velocity of the augmentation response proximal and distal to the thrombus	<b>Answer:</b> C. Location, estimated age and extent of thrombus<br><br><b>Feedback:</b><br>When reporting on DVT, the location, estimated age (acute or chronic) and extent of thrombus should be provided. Exercise and augmentation will not be performed with patients with suspected DVT.
"Which of the following is an appropriate indication for an extracranial arterial duplex exam?<br><br><b>A:</b> Follow up exam 6 months after initial diagnosis on patient with &lt;50% ICA stenosis<br><b>B:</b> Screening exam on a patient with low Framingham risk scoring and no other assessment<br><b>C:</b> Hollenhorst plaque identified on retinal examination<br><b>D:</b> 3 month follow up to evaluate a carotid stent in stable patient<br><br><img src=""q99_1.jpg"" alt=""Question 99 image""><br><br><img src=""q99_2.jpg"" alt=""Question 99 image"">"	<b>Answer:</b> C. Hollenhorst plaque identified on retinal examination<br><br><b>Feedback:</b><br>Hollenhorst plaques are evidence of arterial emboli and are identified on retinal examination. The carotid arteries should be evaluated for the source of the plaque. Screening exams are not recommended for patients with low Framingham risk scoring and no other assessment. They are assumed to be at low risk of disease. 6 month follow up exams are usually reserved for patients with ICA stenosis that is 70% or greater. In the first year after placement of a carotid stent, 1 month baseline exam and a 6 month follow up exam are recommended in stable patients. Regarding the Appropriate Use Criteria as a whole, the list of what is not appropriate is easier to commit to memory than what is appropriate. Review both lists below.
The most common complication of lower extremity DVT is:<br><br><b>A:</b> phlegmasia cerulea dolens<br><b>B:</b> pulmonary embolism<br><b>C:</b> phlegmasia cerulea alba<br><b>D:</b> valvular incompetence	<b>Answer:</b> D. valvular incompetence<br><br><b>Feedback:</b><br>The presence of DVT damages venous valvular structure and motion and venous insufficiency is the most common sequela seen with DVT. Pulmonary embolism is the most critical complication of a DVT. Phlegmasia alba dolens is an extensive iliofemoral thrombosis, usually due to stasis of uterine blood with recent pelvic surgery or pregnancy. It presents as painful swelling and pallor of the entire leg (milk leg). Phlegmasia cerulea dolens is an uncommon severe form of DVT which results from extensive thrombotic occlusion of the veins of an extremity. It presents as painful &quot;blue&quot; swollen leg. Milk leg becomes Blue leg if untreated.
"What is the preferred manipulation technique that can be used to convert the partial subclavian steal into a complete steal?<br><br><b>A:</b> Re-scan the patient in Fowler&#x27;s position.<br><b>B:</b> Have the patient perform 40 flexion/extension maneuvers of the left arm and then re-evaluate the vertebral flow.<br><b>C:</b> Have the patient squeeze a stress ball 40 times in the right arm and then re-evaluate the vertebral flow.<br><b>D:</b> Have patient sit up in an exaggerated military stance and then re-evaluate the vertebral flow.<br><br><img src=""q101.jpg"" alt=""Question 101 image"">"	<b>Answer:</b> B. Have the patient perform 40 flexion/extension maneuvers of the left arm and then re-evaluate the vertebral flow.<br><br><b>Feedback:</b><br>By exercising the left arm, the muscles will require more incoming blood flow. The pressure in the distal arm will decrease to allow more flow to travel to the arm. The left vertebral artery is the only supplying vessel for the left arm, due to the subclavian occlusion. This increase in blood flow needs in the left arm will lead to complete reversal of flow in the left vertebral as it tries to keep up with the change in the blood flow needs in the left arm.
"Which of the following is a sign or symptom of chronic DVT?<br><br><b>A:</b> Redness<br><b>B:</b> Positive Homan&#x27;s Sign<br><b>C:</b> Warmth<br><b>D:</b> Brawny Discoloration<br><br><img src=""q102.jpg"" alt=""Question 102 image"">"	<b>Answer:</b> D. Brawny Discoloration<br><br><b>Feedback:</b><br>Hyperpigmentation refers to brawny discoloration of the distal 1/3 of the calf. It is caused by cell debris and waste accumulating in the tissues outside the veins. Homan&#x27;s sign refers to calf pain with quick dorsiflexion of the foot. This can be a sign of a DVT with the calf pain relating to the inability to pump out the blood when the muscle is quickly contracted. Swelling, warmth and redness are all related to venous stasis in the vessels below the area of DVT.
When performing a treadmill test for PAD, exercise is normally performed ________________. When performing a reactive hyperemia exam for PAD, the cuffs are inflated ________________.<br><br><b>A:</b> with the patient standing, with the patient supine<br><b>B:</b> for up to 5 minutes, for up to 5 minutes<br><b>C:</b> with the patient supine, with the patient standing<br><b>D:</b> for up to 10 minutes, for up to 5 minutes	<b>Answer:</b> B. for up to 5 minutes, for up to 5 minutes<br><br><b>Feedback:</b><br>When performing a treadmill test for PAD, exercise is normally performed for up to 5 minutes. When performing a reactive hyperemia exam for PAD, the cuffs are inflated for up to 5 minutes. Reactive hyperemia is used to simulate exercise in patients that cannot perform exercise. If the patient experiences symptoms, the exam can be terminated earlier.
Use your mouse to move the cursor over the saphenous tributary vein and click to mark the vessel.	<b>Answer:</b> Unavailable<br><br><b>Feedback:</b><br>The saphenous veins course within the saphenous compartment that is formed by the two layers of fascia. Tributary veins are found superficial to the superficial fascia.
When performing an upper extremity venous Doppler evaluation for thrombosis, which of the following veins should be evaluated on the exam?<br><br><b>A:</b> axillary, cephalic, basilic and brachial veins<br><b>B:</b> axillary, brachial and deep forearm veins<br><b>C:</b> cephalic, basilic and brachial veins<br><b>D:</b> subclavian, axillary, cephalic, basilic and brachial veins	<b>Answer:</b> D. subclavian, axillary, cephalic, basilic and brachial veins<br><br><b>Feedback:</b><br>When performing an upper extremity venous Doppler evaluation for thrombosis, the subclavian, axillary, cephalic, basilic and brachial veins should be evaluated on the exam. The radial and ulnar veins are not typically evaluated at length, similar to the calf veins on a lower extremity exam.
Which of the following causes an increase in the resistive index(RI) of the distal common carotid artery?<br><br><b>A:</b> aortic valve insufficiency<br><b>B:</b> proximal ICA stenosis<br><b>C:</b> proximal CCA stenosis<br><b>D:</b> Valsalva maneuver	<b>Answer:</b> B. proximal ICA stenosis<br><br><b>Feedback:</b><br>An occlusion of the ICA will lead to increased resistance to the flow in the ipsilateral common carotid artery.
"The images demonstrated are from a mesenteric Doppler exam. The patient was NPO for the exam. The IMA was also evaluated and demonstrated a monophasic, high resistance waveform with a peak velocity of 150cm/s. What do these findings indicate?<br><br><b>A:</b> Normal exam<br><b>B:</b> SMA stenosis<br><b>C:</b> Normal SMA and IMA flow but a tardus parvus waveform is identified in the celiac axis.<br><b>D:</b> Mesenteric ischemia<br><br><img src=""q107.jpg"" alt=""Question 107 image"">"	<b>Answer:</b> B. SMA stenosis<br><br><b>Feedback:</b><br>Mesenteric ischemia requires stenosis or occlusion of at least two of the mesenteric arteries. (Celiac, SMA, or IMA) Only SMA stenosis is present. The other velocities are normal for the IMA and celiac.
Which of the following indicates single level arterial obstruction in the leg?<br><br><b>A:</b> ABI &lt;0.5<br><b>B:</b> velocity of 200cm/s or less<br><b>C:</b> ABI &gt;0.5<br><b>D:</b> post exercise ankle recovery time 6-12 minutes	<b>Answer:</b> C. ABI &gt;0.5<br><br><b>Feedback:</b><br>ABI &gt;0.5 single level disease; ABI &lt;0.5 multi-level disease
"Bilateral homonymous hemianopia is most commonly seen with:<br><br><b>A:</b> internal carotid artery stenosis<br><b>B:</b> subclavian vein thrombosis<br><b>C:</b> abdominal aortic aneurysm<br><b>D:</b> vertebrobasilar disease<br><br><img src=""q109.jpg"" alt=""Question 109 image"">"	<b>Answer:</b> D. vertebrobasilar disease<br><br><b>Feedback:</b><br>Bilateral visual symptoms are most commonly related to vertebrobasilar disease and reduced flow to the occipital lobes of the brain. Unilateral visual symptoms are most commonly related to ICA disease and decreased flow to the ophthalmic artery.
If the stenosis/blockage reduces the vessel lumen to 1/4 of the normal vessel area, the velocity of flow at the stenosis must _________________to maintain the flow rate<br><br><b>A:</b> double<br><b>B:</b> increase by 400%<br><b>C:</b> quadruple<br><b>D:</b> decrease by 25%	<b>Answer:</b> C. quadruple<br><br><b>Feedback:</b><br>If the stenosis/blockage reduces the lumen to 1/4 of the normal vessel area, the velocity of flow at the stenosis must quadruple to maintain the flow rate.
"Which of the following is a characteristic of the Doppler waveform obtained distal to the site of stenosis in an ICA that demonstrates string flow on color Doppler?<br><br><b>A:</b> blunted waveform<br><b>B:</b> decreased acceleration time<br><b>C:</b> spectral window<br><b>D:</b> increased diastolic flow<br><br><img src=""q111.jpg"" alt=""Question 111 image"">"	<b>Answer:</b> A. blunted waveform<br><br><b>Feedback:</b><br>Near occlusion of the ICA will lead to low velocity systolic flow with minimal diastolic flow (blunted waveform). Once total occlusion occurs, diastolic flow ceases or flow reversal occurs in the artery just proximal to the occlusion.
"Letter T indicates which of the following structures?<br><br><b>A:</b> right renal artery<br><b>B:</b> IVC<br><b>C:</b> superior mesenteric artery<br><b>D:</b> left renal artery<br><br><img src=""q112.jpg"" alt=""Question 112 image"">"	<b>Answer:</b> A. right renal artery<br><br><b>Feedback:</b><br>
