The following pressure readings from a segmental pressure evaluation were obtained in a patient suffering from low back and thigh pain. What is the ABI for each leg? Lt Ankle 136 Rt Ankle 128 Lt Arm 124 Rt Arm 120<br><br><b>A:</b> Rt = 1.07, Lt = 1.10<br><b>B:</b> Rt = 0.94, Lt = 0.91<br><b>C:</b> Rt = 1.03, Lt = 1.13<br><b>D:</b> Rt = 1.03, Lt = 1.10	<b>Answer:</b> D. Rt = 1.03, Lt = 1.10<br><br><b>Feedback:</b><br>Rt ABI = 128/124 = 1.03 Lt ABI = 136/124 = 1.10 You should not have complicated math problems on the registry exam. The most important part of any calculation is to know how to set up the calculation. The highest calf artery pressure is divided by the highest brachial pressure to calculate the ABI.
A fem - tib graft is used to treat:<br><br><b>A:</b> unilateral iliac stenosis<br><b>B:</b> bilateral popliteal stenosis<br><b>C:</b> bilateral iliac stenosis<br><b>D:</b> unilateral distal femoral stenosis	<b>Answer:</b> D. unilateral distal femoral stenosis<br><br><b>Feedback:</b><br>A fem - tib graft can be used to correct unilateral distal femoral or popliteal stenosis. The femoral artery is connected by a graft to the anterior tibial artery or tibioperoneal trunk distal to the obstruction.
"Congestive heart failure causes increased pulsatility in the:<br><br><b>A:</b> bilateral superficial femoral arteries<br><b>B:</b> renal arteries and veins<br><b>C:</b> bilateral carotid arteries<br><b>D:</b> iliac veins and portal veins<br><br><img src=""q43.jpg"" alt=""Question 43 image"">"	<b>Answer:</b> D. iliac veins and portal veins<br><br><b>Feedback:</b><br>CHF causes reduced cardiac output and a backlog if flow in the venous system. The systemic and portal venous system can demonstrate increased pulsatility with CHF. The decreased cardiac output can reduce pulsatility in the distal arterial system.
Aspirin would be the preferred treatment for which of the following patients?<br><br><b>A:</b> 60% internal carotid stenosis<br><b>B:</b> presence of significant venous reflux<br><b>C:</b> total occlusion of an internal carotid artery<br><b>D:</b> compartment syndrome	<b>Answer:</b> A. 60% internal carotid stenosis<br><br><b>Feedback:</b><br>Aspirin prevents platelet aggregation in the arteries which reduces the ability of plaque to form. Patients with mild to moderate carotid stenosis can benefit from an aspirin each day.
"The popliteal artery ___________ the popliteal vein.<br><br><b>A:</b> courses anterior to<br><b>B:</b> is more tortuous than<br><b>C:</b> is larger than<br><b>D:</b> courses posterior to<br><br><img src=""q45.jpg"" alt=""Question 45 image"">"	<b>Answer:</b> A. courses anterior to<br><br><b>Feedback:</b><br>The popliteal artery courses anterior to the popliteal vein. When answering questions regarding anatomic relationships and considering US images, always start by considering the transducer placement on the body. The popliteal vein is imaged by placing the transducer in the posterior popliteal fossa. The anterior aspect of this image is the posterior aspect of the patient.
A patient presents with HTN, DM and left lower extremity pain that occurs only as he walks. He usually begins to have pain after he walks to his mailbox with increasing pain as he returns to the house. The pain is relieved by resting his legs for a few minutes. What would the predicted ABI value be for the left leg?<br><br><b>A:</b> 0.9<br><b>B:</b> 0.6<br><b>C:</b> 0.4<br><b>D:</b> above 1.0; these symptoms are most likely unrelated to arterial disease	<b>Answer:</b> B. 0.6<br><br><b>Feedback:</b><br>The patient is experiencing claudication which is found in patients with 0.5 - 0.9 ABI. The short distance of walking to the mailbox before the pain begins indicates a more significant amount of disease than 0.9 ABI would indicate. An ABI of 0.6 is the best choice with the given symptoms.
An upper extremity segmental pressure exam produces the following pressures: Brachial RT 140mmHg AND LT 132mmHg Radial RT 144mmHg AND LT 136mmHg Ulnar RT 138mmHg AND LT 138mmHg 2nd Digit RT 130mmHg AND LT 104mmHg What should you do next for this patient?<br><br><b>A:</b> end the exam and report right palmar arch disease<br><b>B:</b> perform digital pressures on at least one more digit on the right hand<br><b>C:</b> perform digital pressures on at least one more digit on the left hand<br><b>D:</b> end the exam and report left palmar arch disease	<b>Answer:</b> C. perform digital pressures on at least one more digit on the left hand<br><br><b>Feedback:</b><br>When the arm pressures are normal, but the digital pressure is abnormally reduced, there could be disease in the palmar arch or the single digit. To provide a complete evaluation, at least one more digit on the left hand should be evaluated. If the additional digit pressure is abnormal, disease in the palmar arch is the most likely cause for the reduced digit pressures. If the additional digit pressure is normal, the remaining digits should be tested to confirm that the reduced pressure is limited to the single digit and disease of that digital artery should be suspected.
What critical finding is associated with calf paresthesia, localized muscle weakness, pain when stretching calf muscles, and drop foot?<br><br><b>A:</b> peripheral arterial disease<br><b>B:</b> anterior compartment syndrome<br><b>C:</b> popliteal entrapment<br><b>D:</b> post-phlebitic syndrome	<b>Answer:</b> B. anterior compartment syndrome<br><br><b>Feedback:</b><br>Acute compartment syndrome is a medical emergency. It is usually caused by a severe injury and without intervention, it can lead to permanent muscle damage. Symptoms of compartment syndrome include paresthesia, localized muscle weakness, pain when stretching calf muscles, drop foot.
A patient presents 3 days after left hip surgery for a DVT evaluation. There is severe edema from the hip to the ankle and the leg has a mild cyanotic appearance. You identify acute thrombus from the common femoral vein through the calf veins. The great saphenous vein is also occluded by thrombus. What is the diagnosis for this condition?<br><br><b>A:</b> Budd Chiari syndrome<br><b>B:</b> Phlegmasia Cerulea Dolens<br><b>C:</b> Phlegmasia Alba Dolens<br><b>D:</b> Acute arterial occlusion	<b>Answer:</b> B. Phlegmasia Cerulea Dolens<br><br><b>Feedback:</b><br>Phlegmasia Cerulea Dolens refers to extensive DVT occluding deep system and superficial system. Arterial inflow is significantly affected. Severe limb edema and mottled skin are noted with cyanosis due to high concentration of deoxygenated blood. Tip for remembering the difference between Cerulea Dolens and Alba Dolens, &quot;C&quot;erulea causes &quot;C&quot;yanosis of the leg, while Alba Dolens results in pallor.
A 65yr old female presents chronic leg pain and swelling, but no brown discoloration is present in the distal calf and ankle area. Which of the following patient history questions would provide an explanation of the symptoms?<br><br><b>A:</b> Do you have pain in the legs at night when in bed?<br><b>B:</b> Does your pain increase with quick dorsiflexion of the left foot?<br><b>C:</b> Have you had coronary artery bypass surgery?<br><b>D:</b> If you elevate the leg, does the pain increase?	<b>Answer:</b> C. Have you had coronary artery bypass surgery?<br><br><b>Feedback:</b><br>The great saphenous is removed for most CABG procedures. The removal of this vessel can lead to swelling in the leg with the reduced outflow. Brown discoloration is not a common sign of GSV removal because the reduced outflow is in the deep veins and not related to insufficiency. Pain with quick dorsiflexion of the foot is a sign of DVT called Homan&#x27;s sign. Pain increase with leg elevation or at night would indicate arterial disease, which does not correlate with swelling.
"A carotid Doppler exam demonstrates an occlusion of the left ICA, but the distal ICA demonstrates retrograde flow. The ECA demonstrates antegrade flow with increased diastolic flow. The ophthalmic artery on the left side demonstrates flow moving away from the transducer. Where is the collateral flow coming from?<br><br><b>A:</b> cross over collateralization through the ACA<br><b>B:</b> ECA to ICA collateralization<br><b>C:</b> vertebrobasilar collateralization<br><b>D:</b> ophthalmic to ophthalmic collateralization<br><br><img src=""q51.jpg"" alt=""Question 51 image"">"	<b>Answer:</b> B. ECA to ICA collateralization<br><br><b>Feedback:</b><br>Flow reversal in the ophthalmic artery is a key sign of ECA to ICA collateral flow. If the ICA is obstructed proximally, collateral flow can refill the ICA distally. Flow moves from the left ECA - left superficial temporal artery - left supraorbital artery(reversed) - left ophthalmic artery(reversed) - distal left ICA (reversed)
Which of the following patients has the lowest risk of a future stroke that affects the right side?<br><br><b>A:</b> total occlusion of the left ICA<br><b>B:</b> 60% left ICA stenosis caused by heterogeneous calcific plaque<br><b>C:</b> 20% left ICA stenosis caused by smooth, soft plaque<br><b>D:</b> no appreciable plaque identified in the left ICA	<b>Answer:</b> A. total occlusion of the left ICA<br><br><b>Feedback:</b><br>A stenosis on the left internal carotid artery will cause symptoms on the right side of the body. The risk of a future stroke on that side drops significantly when the internal carotid artery is totally occluded. If a stroke would occur, it would have happened at the time the occlusion occurred.
Which of the following describes a normal lower extremity response to the Valsalva maneuver?<br><br><b>A:</b> the femoral vein will demonstrate cardiac pulsatility<br><b>B:</b> flow in the femoral vein will stop at onset of the maneuver<br><b>C:</b> flow in the subclavian vein will be augmented toward the heart with slight reversal upon release<br><b>D:</b> flow in the iliac vein will reverse for at least 1 second before normalizing	<b>Answer:</b> B. flow in the femoral vein will stop at onset of the maneuver<br><br><b>Feedback:</b><br>The Valsalva maneuver will significantly decrease or stop flow toward the heart in the deep veins of the legs. Upon release of the maneuver, flow will be briefly augmented toward the heart and then normalize.
Which of the following is a sign of a functioning hemodialysis graft?<br><br><b>A:</b> pain or pallor in the hand<br><b>B:</b> palpable thrill over the graft<br><b>C:</b> absence of a palpable thrill over the graft<br><b>D:</b> presence of a water hammer pulse	<b>Answer:</b> B. palpable thrill over the graft<br><br><b>Feedback:</b><br>A normal AVG should demonstrate a palpable thrill as blood flow moves through it. Absence of the thrill or a water hammer pulse is indicative of an occluded graft. If the graft becomes stenosed or occluded, the distal forearm and hand could become ischemic.
An 80yr old female patient asks you to explain the purpose of a segmental pressure exam of the lower extremities. Which of the following is the best response?<br><br><b>A:</b> Tell her you are going to squeeze her legs for a minute just relax.<br><b>B:</b> Tell her that the pressure in your legs decreases with disease and the doctor wants to see how much her ankle pressures have dropped.<br><b>C:</b> Tell her the exam uses blood pressure cuffs to take her blood pressure in her legs to evaluate the circulation to her feet.<br><b>D:</b> Tell her the exam uses blood pressure cuffs to take her blood pressure in her legs to see if she needs surgery.	<b>Answer:</b> C. Tell her the exam uses blood pressure cuffs to take her blood pressure in her legs to evaluate the circulation to her feet.<br><br><b>Feedback:</b><br>Always tailor your explanation to your audience. Limit technical details that are not relevant for the patient. You should not suggest that surgery may be necessary or that her ankle pressures are decreased. As a Sonographer, you should always explain the exam and never be condescending or dismissive of a patient&#x27;s request.
"When removing a protective gown:<br><br><b>A:</b> untie the strings, roll the gown upward from the bottom edge to turn it inside out, pull it from the shoulders and off the arms, remove your gloves, wash your hands<br><b>B:</b> untie the strings, pull the gown forward from the shoulders using the neck strings to turn it inside out as it is removed, remove your gloves, wash your hands<br><b>C:</b> remove your gloves, untie the strings, pull the gown forward from the center of the front of the gown to remove it with the exposed side out, roll it into a ball, wash your hands<br><b>D:</b> remove your gloves, untie the strings, pull the gown forward from the shoulders using the neck strings, grab the inside shoulder seams to pull it off the arms and turn it inside out as it is removed, wash your hands<br><br><img src=""q56.jpg"" alt=""Question 56 image"">"	<b>Answer:</b> D. remove your gloves, untie the strings, pull the gown forward from the shoulders using the neck strings, grab the inside shoulder seams to pull it off the arms and turn it inside out as it is removed, wash your hands<br><br><b>Feedback:</b><br>When removing a protective gown, remove your gloves, untie the strings, pull the gown forward from the shoulders using the neck strings, grab the inside shoulder seams pull it off the arms and turn it inside out as it is removed, wash your hands.
When evaluating a focal stenosis of the femoral artery, where should you place the cursor to obtain the highest velocity related to the stenosis?<br><br><b>A:</b> immediately proximal to the focal point of the stenosis<br><b>B:</b> 1-2cm proximal to the focal point of the stenosis<br><b>C:</b> at the narrowest point in the vessel or immediately distal to the focal point of the stenosis<br><b>D:</b> 1-2cm distal to the focal point of the stenosis	<b>Answer:</b> C. at the narrowest point in the vessel or immediately distal to the focal point of the stenosis<br><br><b>Feedback:</b><br>When evaluating a focal stenosis of an artery, you should place the cursor at the narrowest point in the vessel or immediately distal to the focal point of the stenosis to obtain the highest velocity related to the stenosis. It is important to move the Doppler cursor through the stenotic area and out the other side to locate the peak velocity.
"Which artery courses anteriorly along the calf and laterally through the interosseous membrane of the leg?<br><br><b>A:</b> distal superficial femoral artery<br><b>B:</b> posterior tibial artery<br><b>C:</b> anterior tibial artery<br><b>D:</b> peroneal artery<br><br><img src=""q58.jpg"" alt=""Question 58 image"">"	<b>Answer:</b> C. anterior tibial artery<br><br><b>Feedback:</b><br>The interosseous membrane connects the medial tibia and anterior fibula and separates the muscles of the calf. The ATA and ATV course just anterior to the membrane.
A patient presents for a venous Doppler evaluation of the lower extremities. The patient is contracted at the knees and hips and unable to extend the legs for the exam. All compression views are normal. Doppler evaluation demonstrates mildly reduced response to distal augmentation in the thigh and continuous flow in the popliteal veins. How will you report these findings?<br><br><b>A:</b> Normal exam with flow changes most likely caused by patient position<br><b>B:</b> Normal exam<br><b>C:</b> Venous insufficiency is present in the upper thigh vessels bilaterally<br><b>D:</b> Probable DVT in the popliteal veins bilaterally	<b>Answer:</b> A. Normal exam with flow changes most likely caused by patient position<br><br><b>Feedback:</b><br>Absence of vein compressibility is the most reliable factor for diagnosing DVT. The patient has normal compression views which indicates the absence of DVT. The contracted position of the patient can cause a more continuous waveform and decrease in augmentation response.
"If the image displayed is a transverse view of the posterior right lower leg, Letter A correspond to:<br><br><b>A:</b> small saphenous vein<br><b>B:</b> posterior tibial vein<br><b>C:</b> medial gastrocnemius vein<br><b>D:</b> great saphenous vein<br><br><img src=""q60.jpg"" alt=""Question 60 image"">"	<b>Answer:</b> A. small saphenous vein<br><br><b>Feedback:</b><br>When imaging the posterior leg, the notch on the transducer should be placed toward the right side of the patient, just like imaging the anterior leg. The right side of the image is lateral and the left side of the image is medial in both imaging views. A. small saphenous vein B. lateral gastrocnemius veins C. medial gastrocnemius veins D. popliteal vein
Pulsatility Index can be used to describe?<br><br><b>A:</b> the amount of blood vessel recoil<br><b>B:</b> the pressure gradient within a vessel<br><b>C:</b> the amount of variation in the velocity during the cardiac cycle<br><b>D:</b> amount of turbulence within a vessel	<b>Answer:</b> C. the amount of variation in the velocity during the cardiac cycle<br><br><b>Feedback:</b><br>The pulsatility index (PI) can be used to describe the amount of variation in the velocity during the cardiac cycle. High resistance flow demonstrates higher PI values than low resistance flow.
"You are evaluating the subclavian artery and its branches. How can you differentiate the vertebral artery from the thyrocervical and costocervical trunks?<br><br><b>A:</b> the trunk arteries have many branches and lower end diastolic flow velocities<br><b>B:</b> the vertebral artery demonstrates flow moving toward the transducer and the trunk arteries demonstrate flow moving away from the transducer<br><b>C:</b> the vertebral artery has many branches and lower end diastolic flow velocities<br><b>D:</b> the vertebral artery demonstrates flow moving away from the transducer and the trunk arteries demonstrate flow toward the transducer<br><br><img src=""q62.jpg"" alt=""Question 62 image"">"	<b>Answer:</b> A. the trunk arteries have many branches and lower end diastolic flow velocities<br><br><b>Feedback:</b><br>Thyrocervical and Costocervical Trunk arteries can be differentiated from the vertebral arteries by their many branches and lower end-diastolic flow velocities. Flow direction should not be used to identify these vessels because of the many variables in evaluation technique and potential flow abnormalities (like a subclavian steal).
"The attached image is taken from the celiac axis on an abdominal Doppler exam. Which of the following is the most likely finding in this patient when the vessel is re-evaluated after eating?<br><br><b>A:</b> no change in flow pattern<br><b>B:</b> decreased resistance with no change in peak velocity<br><b>C:</b> increased resistance and increased peak velocity<br><b>D:</b> decreased resistance and increased peak velocity<br><br><img src=""q63.jpg"" alt=""Question 63 image"">"	<b>Answer:</b> A. no change in flow pattern<br><br><b>Feedback:</b><br>The celiac artery waveform is usually unchanged after eating in the normal patient. The CA mainly supplies the liver and spleen with blood and these organs are low resistance vascular beds. The fasting waveform and peak velocity on this patient are well within normal limits which indicates a normal celiac axis.
"Which of the following terms is a type of visual disturbance where half of the field of view is disrupted in the eye?<br><br><b>A:</b> ectopia<br><b>B:</b> myopia<br><b>C:</b> diplopia<br><b>D:</b> homonymous hemianopia<br><br><img src=""q64.jpg"" alt=""Question 64 image"">"	<b>Answer:</b> D. homonymous hemianopia<br><br><b>Feedback:</b><br>This visual disturbance can be unilateral or bilateral and is commonly caused by ischemia in the occipital lobe of the brain. Medial or lateral half of the field of view in the eye is &quot;absent&quot; while the other half appears normal.
Which modality is preferred to diagnose an aortic dissection?<br><br><b>A:</b> CTA<br><b>B:</b> Duplex ultrasound<br><b>C:</b> Angiography<br><b>D:</b> MRI	<b>Answer:</b> A. CTA<br><br><b>Feedback:</b><br>CT scan is preferred for evaluation of AAA and dissection. The exam provides the best detail for the evaluation of aortic size and lumen characteristics. All portions of the aorta can be seen with CT. Ultrasound can be limited by bony anatomy.
A venous insufficiency exam is performed for a patient with multiple varicosities. The deep system is found to be competent, but there is insufficiency present in the great saphenous vein. Which of the following statements regarding the findings is true?<br><br><b>A:</b> Venous insufficiency is normal in the superficial veins when varicosities are present.<br><b>B:</b> The multiple varicosities are primary varicosities.<br><b>C:</b> The multiple varicosities are primary and secondary varicosities.<br><b>D:</b> The multiple varicosities are secondary varicosities.	<b>Answer:</b> B. The multiple varicosities are primary varicosities.<br><br><b>Feedback:</b><br>Varicosities with superficial venous insufficiency related to deep venous system disease = secondary varicosities Varicosities with incompetent valves causing superficial venous insufficiency and normal deep system = primary varicosities.
Congestive heart failure is more commonly seen with ____________________, while distal ischemia is more commonly seen with _________________.<br><br><b>A:</b> proximal AV fistula, distal AV fistula<br><b>B:</b> distal AV fistula, proximal AV fistula<br><b>C:</b> AV fistula, hemodialysis fistula<br><b>D:</b> AV malformation, AV fistula	<b>Answer:</b> A. proximal AV fistula, distal AV fistula<br><br><b>Feedback:</b><br>Congestive heart failure is more commonly seen with a proximal AVF, while distal ischemia is more commonly seen with distal AVF.
How should you prepare the patient to start the examination used to assess the venous refill time using photoplethysmography?<br><br><b>A:</b> Supine legs elevated with sensor at the medial malleolus<br><b>B:</b> Supine legs elevated with pressure cuff on thigh<br><b>C:</b> Seated at the edge of the table with lower legs dangling, sensor placed at medial malleolus<br><b>D:</b> Standing with the sensor at the medial malleolus	<b>Answer:</b> C. Seated at the edge of the table with lower legs dangling, sensor placed at medial malleolus<br><br><b>Feedback:</b><br>A PPG exam is used to calculate the venous refill time (VRT). A sensor is placed at the medial malleolus and the patient is seated at the edge of the table with their legs dangling. The patient performs a series of foot dorsiflexions to empty the blood from the calf. The strip chart recorder demonstrates the changes in blood volume over time. The time that it takes for the line to plateau again is the venous refill time. VRT &gt;20 seconds is normal; &lt;20 seconds indicates insufficiency. If using APG to evaluate the VRT, a cuff is placed on the lower leg and the patient is put in the supine position with the affected leg elevated. Once the flow empties from the leg, the patient stands up and the VRT is recorded as volume returns to maximum levels under the cuff.
The angular artery is the terminal branch of the<br><br><b>A:</b> Ophthalmic artery<br><b>B:</b> Nasal artery<br><b>C:</b> Facial artery<br><b>D:</b> Anterior cerebral artery	<b>Answer:</b> C. Facial artery<br><br><b>Feedback:</b><br>The angular artery is a terminal branch of the facial artery.
Which of the following is a common infection that causes skin discoloration in patients with venous insufficiency?<br><br><b>A:</b> stasis dermatitis<br><b>B:</b> staphylococcus epidermidis<br><b>C:</b> staphylococcus aureus<br><b>D:</b> arteritis	<b>Answer:</b> A. stasis dermatitis<br><br><b>Feedback:</b><br>Stasis dermatitis is a common inflammatory skin disease. It is usually the earliest cutaneous sequela of chronic venous insufficiency with venous hypertension and causes discoloration of the ankle and calf.
A patient is short of breath after walking to the facility for the arterial duplex evaluation. What is the first thing you should do when starting his exam?<br><br><b>A:</b> Have him rest for 20-30 minutes to allow flow in the legs to normalize<br><b>B:</b> Take his ankle pressures using the PTA and DPA.<br><b>C:</b> Have him lie down and start with the Duplex exam and perform the pressures later.<br><b>D:</b> Take his brachial pressures.	<b>Answer:</b> A. Have him rest for 20-30 minutes to allow flow in the legs to normalize<br><br><b>Feedback:</b><br>If the patient does not rest, the exercise from his long walk can affect the results of the expected resting arterial exam. This can lead to overestimation of the severity of the disease identified on the resting exam.
"While scanning through the suboccipital window with midline angulation, the mean flow velocity increases from 55cm/s to 145cm/s at 105mm in depth. What do these findings mean?<br><br><b>A:</b> Significant stenosis is present in the basilar artery<br><b>B:</b> Normal velocity changes for the tortuous carotid siphon<br><b>C:</b> Significant stenosis is present in the MCA<br><b>D:</b> Normal velocity for the posterior cerebral artery<br><br><img src=""q72.jpg"" alt=""Question 72 image"">"	<b>Answer:</b> A. Significant stenosis is present in the basilar artery<br><br><b>Feedback:</b><br>The mean velocity demonstrates a significant increase at a depth of 105mm which is consistent with stenosis in the basilar artery.
"Which of the following statements describes the findings on the image of the cephalic vein in a patient with a brachiocephalic graft?<br><br><b>A:</b> There is a stenosis distal to the graft<br><b>B:</b> The patient probably has CHF<br><b>C:</b> The measurement indicates normal volume flow rate.<br><b>D:</b> There is a stenosis proximal to the graft<br><br><img src=""q73.jpg"" alt=""Question 73 image"">"	<b>Answer:</b> B. The patient probably has CHF<br><br><b>Feedback:</b><br>A volume flow rate over 1200ml/min indicates possible CHF. A high flow rate can indicate volume overload in the venous system.
